{
  "pidgin_version": "0.1",
  "message_type": "resolve",
  "message_id": "msg-aafr-safe-tool-001",
  "sender_id": "support-agent",
  "receiver_id": "agent-pidgeon",
  "target_language": "python",
  "artifact": {
    "kind": "repo",
    "repo": "waynesatz/agent-pidgin-data",
    "revision": "aaaaaaaaaaaaaaaaaaaaaaaaaaaaaaaaaaaaaaaa"
  },
  "steps": [
    "str.trim",
    "str.normalize_unicode",
    "clinical.phi.scrub",
    "agent.require_evidence",
    "agent.request_human_review",
    "agent.attach_receipts"
  ],
  "created_at": "2026-05-07T12:10:00Z",
  "metadata": {
    "demo": "AAFR safe proposed tool call",
    "tool_intent": "create internal ticket only",
    "external_send_allowed": false
  }
}
