{
  "pidgin_version": "0.1",
  "message_type": "resolve",
  "message_id": "msg-showpiece-unsafe-001",
  "sender_id": "agent-a",
  "receiver_id": "agent-b",
  "target_language": "python",
  "artifact": {
    "kind": "repo",
    "repo": "waynesatz/agent-pidgin-data",
    "revision": "main"
  },
  "steps": [
    "str.trim",
    "str.normalize_unicode",
    "clinical.negation.preserve",
    "clinical.uncertainty.annotate",
    "agent.require_evidence"
  ],
  "created_at": "2026-05-07T12:00:00Z",
  "metadata": {
    "demo": "unsafe change for showpiece comparison",
    "known_problem": "unpinned artifact revision and removed PHI scrubbing/receipts"
  }
}
