{
  "pidgin_version": "0.1",
  "message_type": "resolve",
  "message_id": "msg-sample-001",
  "sender_id": "agent-a",
  "receiver_id": "agent-b",
  "target_language": "python",
  "artifact": {
    "kind": "repo",
    "repo": "waynesatz/agent-pidgin-data",
    "revision": "aaaaaaaaaaaaaaaaaaaaaaaaaaaaaaaaaaaaaaaa"
  },
  "steps": ["str.trim", "str.lowercase", "agent.attach_receipts"],
  "created_at": "2026-03-25T10:30:00Z"
}
